{
  "id": "asm-lapita-teouma-cemetery-frame",
  "entity": "object",
  "object_kind": "assemblage",
  "names": {
    "zh": "特乌马墓地框架组合",
    "en": "Teouma cemetery frame assemblage"
  },
  "civilization_ids": [
    "civ-lapita-pacific"
  ],
  "site_ids": [
    "site-teouma"
  ],
  "period_ids": [
    "period-lapita-remote-oceania"
  ],
  "summary": {
    "zh": "早期拉皮塔墓地组合指针；无伪造个体编号。",
    "en": "Early Lapita cemetery assemblage pointer; no forged individual numbers."
  },
  "sources": [
    "src-lapita-teouma-antiquity",
    "src-lapita-bedford-vanuatu"
  ],
  "rights": {
    "status": "outbound-link-only",
    "license": null,
    "attribution": null,
    "upstream_url": null,
    "notes": "Metadata-only assemblage; no forged plates or museum numbers."
  },
  "media_ids": [],
  "editorial": {
    "derived_from": [
      "tools/wave1_shells/densify_wave1.py",
      "docs/coverage-map.md",
      "docs/decisions.md#d-2026-10-12-13"
    ],
    "derived_on": "2026-10-12",
    "notes": "Wave-1 densify to library-seed-rich (D-2026-10-12-13). No invented pages/coords/finds/media art. Honest thin > fake dense."
  }
}
