{
  "id": "asm-aztec-contact-corridor-r4b",
  "entity": "object",
  "object_kind": "assemblage",
  "names": {
    "zh": "接触走廊组合",
    "en": "Contact corridor assemblage",
    "native": null
  },
  "civilization_ids": [
    "civ-aztec"
  ],
  "site_ids": [
    "site-aztec-zultepec-r4b",
    "site-aztec-cempoala-r4b"
  ],
  "period_ids": [],
  "summary": {
    "zh": "接触期走廊组合。",
    "en": "Contact-period corridor assemblage.",
    "native": null
  },
  "sources": [
    "src-aztec-smith-r4b",
    "src-aztec-matos-r4b"
  ],
  "rights": {
    "status": "outbound-link-only",
    "license": null,
    "attribution": null,
    "upstream_url": null,
    "notes": "Metadata-only assemblage; no forged plates or museum numbers."
  },
  "media_ids": [],
  "editorial": {
    "derived_from": [
      "tools/hot_densify/densify_hot_round4_b.py",
      "docs/coverage-map.md",
      "docs/decisions.md#d-2026-10-12-31"
    ],
    "derived_on": "2026-10-12",
    "notes": "Hot densify Round-4 Batch B sites/objects + promotion eval (D-2026-10-12-31). No invented pages/coords/finds/media. Promote only if numeric AND quality gates pass."
  }
}
