{
  "id": "asm-moche-sipan-seed-i",
  "entity": "object",
  "object_kind": "assemblage",
  "names": {
    "zh": "西潘王陵组合",
    "en": "Sipán royal tomb assemblage",
    "native": null
  },
  "civilization_ids": [
    "civ-moche"
  ],
  "site_ids": [
    "site-moche-sipan-seed-i"
  ],
  "period_ids": [],
  "summary": {
    "zh": "王陵金属器组合。",
    "en": "Royal tomb metal assemblage.",
    "native": null
  },
  "sources": [
    "src-moche-alva-seed-i",
    "src-moche-metallurgy-seed-i"
  ],
  "rights": {
    "status": "outbound-link-only",
    "license": null,
    "attribution": null,
    "upstream_url": null,
    "notes": "Metadata-only assemblage; no forged plates or museum numbers."
  },
  "media_ids": [],
  "editorial": {
    "derived_from": [
      "tools/hot_densify/densify_seed_batch_i.py",
      "docs/coverage-map.md",
      "docs/decisions.md#d-2026-10-13-03"
    ],
    "derived_on": "2026-10-13",
    "notes": "Seed densify Batch I toward ~48 sources (D-2026-10-13-03). No invented pages/coords/finds/media. Status stays library-seed-rich."
  }
}
