{
  "id": "asm-elam-haft-tepe-admin-r2",
  "entity": "object",
  "object_kind": "assemblage",
  "names": {
    "zh": "哈夫特特佩行政组合",
    "en": "Haft Tepe administrative frame",
    "native": null
  },
  "civilization_ids": [
    "civ-elam-iran"
  ],
  "site_ids": [
    "site-elam-haft-tepe-tomb-r2",
    "site-haft-tepe-kabnak"
  ],
  "period_ids": [],
  "summary": {
    "zh": "中埃兰行政/墓葬中心组合。",
    "en": "Middle Elamite admin/tomb centre frame.",
    "native": null
  },
  "sources": [
    "src-elam-haft-tepe-negahban-r2",
    "src-elam-negahban-deepen"
  ],
  "rights": {
    "status": "outbound-link-only",
    "license": null,
    "attribution": null,
    "upstream_url": null,
    "notes": "Metadata-only assemblage; no forged plates or museum numbers."
  },
  "media_ids": [],
  "editorial": {
    "derived_from": [
      "tools/hot_densify/densify_hot_round2_b.py",
      "docs/coverage-map.md",
      "docs/decisions.md#d-2026-10-12-23"
    ],
    "derived_on": "2026-10-12",
    "notes": "Hot-pack densify Round-2 toward denser archive (D-2026-10-12-23). No invented pages/coords/finds/media art. Status stays library-seed-rich (still below Egypt-level fact-library)."
  }
}
