{
  "id": "asm-nuragic-contact-seed-n",
  "entity": "object",
  "object_kind": "assemblage",
  "names": {
    "zh": "腓尼基接触组合",
    "en": "Phoenician-contact assemblage",
    "native": null
  },
  "civilization_ids": [
    "civ-nuragic-sardinia"
  ],
  "site_ids": [
    "site-nuragic-phoenician-seed-n"
  ],
  "period_ids": [],
  "summary": {
    "zh": "接触。",
    "en": "Contact.",
    "native": null
  },
  "sources": [
    "src-nuragic-phoenician-seed-n",
    "src-nuragic-iron-seed-n"
  ],
  "rights": {
    "status": "outbound-link-only",
    "license": null,
    "attribution": null,
    "upstream_url": null,
    "notes": "Metadata-only assemblage; no forged plates or museum numbers."
  },
  "media_ids": [],
  "editorial": {
    "derived_from": [
      "tools/hot_densify/densify_seed_batch_n.py",
      "docs/coverage-map.md",
      "docs/decisions.md#d-2026-10-13-08"
    ],
    "derived_on": "2026-10-13",
    "notes": "Seed densify Batch N toward ~71 sources (D-2026-10-13-08). No invented pages/coords/finds/media. Status stays library-seed-rich."
  }
}
