{
  "id": "asm-hallstatt-magdalenenberg-seed-j",
  "entity": "object",
  "object_kind": "assemblage",
  "names": {
    "zh": "马格达莱内贝格组合",
    "en": "Magdalenenberg assemblage",
    "native": null
  },
  "civilization_ids": [
    "civ-hallstatt-celtic"
  ],
  "site_ids": [
    "site-hallstatt-magdalenenberg-seed-j"
  ],
  "period_ids": [],
  "summary": {
    "zh": "大型坟墩组合。",
    "en": "Large-tumulus assemblage.",
    "native": null
  },
  "sources": [
    "src-hallstatt-wagon-seed-j",
    "src-hallstatt-cunliffe-seed-j"
  ],
  "rights": {
    "status": "outbound-link-only",
    "license": null,
    "attribution": null,
    "upstream_url": null,
    "notes": "Metadata-only assemblage; no forged plates or museum numbers."
  },
  "media_ids": [],
  "editorial": {
    "derived_from": [
      "tools/hot_densify/densify_seed_batch_j.py",
      "docs/coverage-map.md",
      "docs/decisions.md#d-2026-10-13-04"
    ],
    "derived_on": "2026-10-13",
    "notes": "Seed densify Batch J toward ~48 sources (D-2026-10-13-04). No invented pages/coords/finds/media. Status stays library-seed-rich."
  }
}
