{
  "id": "asm-nok-style-workshop-seed-l",
  "entity": "object",
  "object_kind": "assemblage",
  "names": {
    "zh": "风格作坊取向组合",
    "en": "Style workshop orientation Seed L assemblage",
    "native": null
  },
  "civilization_ids": [
    "civ-nok-west-africa"
  ],
  "site_ids": [
    "site-nok-style-workshop-seed-l"
  ],
  "period_ids": [],
  "summary": {
    "zh": "作坊。",
    "en": "Workshops.",
    "native": null
  },
  "sources": [
    "src-nok-sculptural-style-seed-l",
    "src-nok-terracotta-seed-l"
  ],
  "rights": {
    "status": "outbound-link-only",
    "license": null,
    "attribution": null,
    "upstream_url": null,
    "notes": "Metadata-only assemblage; no forged plates or museum numbers."
  },
  "media_ids": [],
  "editorial": {
    "derived_from": [
      "tools/hot_densify/densify_seed_batch_l.py",
      "docs/coverage-map.md",
      "docs/decisions.md#d-2026-10-13-06"
    ],
    "derived_on": "2026-10-13",
    "notes": "Seed densify Batch L toward ~71 sources (D-2026-10-13-06). No invented pages/coords/finds/media. Status stays library-seed-rich."
  }
}
